{
  "$schema": "schema/course.schema.json",
  "id": "qubite-english-base",
  "version": 1,
  "title_ru": "Английский в Qubite: говорить с нуля до B2",
  "placement": "placement.json",
  "levels": [
    {
      "id": "a0",
      "cefr": "Pre-A1",
      "title_ru": "Старт: с нуля",
      "about_ru": "Для тех, кто почти не знает английского. Короткие фразы о себе: привет, имя, возраст, откуда ты, что любишь. Много русского, всё очень медленно.",
      "can_do_en": [
        "I can say hello and goodbye and tell my name and age.",
        "I can spell my name and say numbers up to 20.",
        "I can say where I am from and what I like."
      ],
      "words_total": 250,
      "tutor_language": {
        "mode": "ru_heavy",
        "rules_ru": "Объясняет и даёт задания по-русски, по-английски — только слова и короткие фразы урока, медленно, каждую новую фразу сразу переводит. Не понял — сразу по-русски. Строгость мягче: ругает ошибку коротко и смешно, хвалит чаще."
      },
      "exit": {
        "about_ru": "Итоговый урок «Познакомься с Нейтом»: минута о себе голосом без подсказок — имя, возраст, город, семья, что любишь, какой сегодня день.",
        "min_lessons_passed": 0.8,
        "boss_lesson": "a0-m3-l4"
      },
      "modules": [
        {
          "id": "a0-m1",
          "title_ru": "Привет!",
          "title_en": "Hello!",
          "goal_ru": "Поздороваться, назвать имя, сказать, как дела, назвать числа и возраст, продиктовать ник по буквам.",
          "lessons": [
            {
              "id": "a0-m1-l1",
              "title_ru": "Привет, я…",
              "goal_ru": "После урока ты сможешь поздороваться, назвать своё имя и спросить имя собеседника.",
              "detail": "full",
              "file": "lessons/a0/a0-m1-l1.json"
            },
            {
              "id": "a0-m1-l2",
              "title_ru": "Как дела?",
              "goal_ru": "После урока ты сможешь спросить «как дела?» и честно ответить, как ты себя чувствуешь.",
              "detail": "full",
              "file": "lessons/a0/a0-m1-l2.json"
            },
            {
              "id": "a0-m1-l3",
              "title_ru": "Числа и возраст",
              "goal_ru": "После урока ты сможешь считать до 20 и сказать, сколько тебе лет.",
              "detail": "full",
              "file": "lessons/a0/a0-m1-l3.json"
            },
            {
              "id": "a0-m1-l4",
              "title_ru": "Алфавит и ник",
              "goal_ru": "После урока ты сможешь продиктовать своё имя и игровой ник по буквам.",
              "detail": "full",
              "file": "lessons/a0/a0-m1-l4.json"
            }
          ]
        },
        {
          "id": "a0-m2",
          "title_ru": "Это я",
          "title_en": "This is me",
          "goal_ru": "Рассказать, откуда ты, показать свои вещи, назвать цвета и представить семью и друзей.",
          "lessons": [
            {
              "id": "a0-m2-l1",
              "title_ru": "Откуда ты?",
              "goal_ru": "После урока ты сможешь сказать, откуда ты, и спросить об этом другого.",
              "detail": "full",
              "file": "lessons/a0/a0-m2-l1.json"
            },
            {
              "id": "a0-m2-l2",
              "title_ru": "Мои вещи",
              "goal_ru": "После урока ты сможешь назвать вещи в рюкзаке и на столе и спросить «что это?».",
              "detail": "full",
              "file": "lessons/a0/a0-m2-l2.json"
            },
            {
              "id": "a0-m2-l3",
              "title_ru": "Цвета и любимое",
              "goal_ru": "После урока ты сможешь назвать цвета и сказать, какой у тебя любимый цвет и любимая вещь.",
              "detail": "full",
              "file": "lessons/a0/a0-m2-l3.json"
            },
            {
              "id": "a0-m2-l4",
              "title_ru": "Семья и друзья",
              "goal_ru": "После урока ты сможешь представить родных и друзей: кто это, как зовут, сколько лет.",
              "detail": "full",
              "file": "lessons/a0/a0-m2-l4.json"
            }
          ]
        },
        {
          "id": "a0-m3",
          "title_ru": "Мой день",
          "title_en": "My day",
          "goal_ru": "Дни недели и время, что любишь и не любишь, школьные предметы — и минута о себе.",
          "lessons": [
            {
              "id": "a0-m3-l1",
              "title_ru": "Дни и время",
              "goal_ru": "После урока ты сможешь назвать день недели и сказать, который час.",
              "detail": "full",
              "file": "lessons/a0/a0-m3-l1.json"
            },
            {
              "id": "a0-m3-l2",
              "title_ru": "Люблю и не люблю",
              "goal_ru": "После урока ты сможешь сказать, что ты любишь и не любишь из еды, игр и музыки.",
              "detail": "full",
              "file": "lessons/a0/a0-m3-l2.json"
            },
            {
              "id": "a0-m3-l3",
              "title_ru": "Школьные предметы",
              "goal_ru": "После урока ты сможешь назвать школьные предметы и сказать, какой у тебя любимый.",
              "detail": "full",
              "file": "lessons/a0/a0-m3-l3.json"
            },
            {
              "id": "a0-m3-l4",
              "title_ru": "Итог: познакомься с Нейтом",
              "goal_ru": "После урока ты сможешь минуту рассказывать о себе по-английски без подсказок.",
              "detail": "full",
              "file": "lessons/a0/a0-m3-l4.json"
            }
          ]
        }
      ]
    },
    {
      "id": "a1",
      "cefr": "A1",
      "title_ru": "Начальный: мой мир",
      "about_ru": "Обычный день, дом и город, еда и магазин, хобби и умения, что было вчера и что будет. Простые предложения в настоящем и прошедшем, вопросы.",
      "can_do_en": [
        "I can describe my daily routine and ask others about theirs.",
        "I can say what there is in my room and in my city and ask the way.",
        "I can order food and ask how much something costs.",
        "I can say what I did yesterday and what I am going to do."
      ],
      "words_total": 700,
      "tutor_language": {
        "mode": "ru_support",
        "rules_ru": "Говорит по-английски короткими фразами из слов урока, задания и объяснения грамматики — по-русски. Новое слово — сразу перевод. Не понял со второго раза — объясняет по-русски. Ученик может спросить по-русски в любой момент."
      },
      "exit": {
        "about_ru": "Итоговый урок «Моя жизнь по-английски»: две минуты голосом — обычный день, город, хобби, что было в выходные и планы — и разговор с Нейтом на эти темы.",
        "min_lessons_passed": 0.8,
        "boss_lesson": "a1-m6-l4"
      },
      "modules": [
        {
          "id": "a1-m1",
          "title_ru": "Мой обычный день",
          "title_en": "My daily life",
          "goal_ru": "Present Simple: рассказать о своём дне и дне друга, задать вопросы, сказать, как часто.",
          "lessons": [
            {
              "id": "a1-m1-l1",
              "title_ru": "Моё утро",
              "goal_ru": "После урока ты сможешь рассказать, что ты делаешь утром и во сколько.",
              "detail": "full",
              "file": "lessons/a1/a1-m1-l1.json"
            },
            {
              "id": "a1-m1-l2",
              "title_ru": "День друга",
              "goal_ru": "После урока ты сможешь рассказать о дне друга или брата, не забывая окончание -s.",
              "detail": "full",
              "file": "lessons/a1/a1-m1-l2.json"
            },
            {
              "id": "a1-m1-l3",
              "title_ru": "Ты…? Вопросы",
              "goal_ru": "После урока ты сможешь задавать вопросы о привычках с do и does и коротко отвечать.",
              "detail": "full",
              "file": "lessons/a1/a1-m1-l3.json"
            },
            {
              "id": "a1-m1-l4",
              "title_ru": "Как часто?",
              "goal_ru": "После урока ты сможешь сказать, как часто ты что-то делаешь: всегда, обычно, иногда, никогда.",
              "detail": "full",
              "file": "lessons/a1/a1-m1-l4.json"
            }
          ]
        },
        {
          "id": "a1-m2",
          "title_ru": "Где что",
          "title_en": "Places",
          "goal_ru": "Комната и город: there is / there are, предлоги места, спросить и объяснить дорогу.",
          "lessons": [
            {
              "id": "a1-m2-l1",
              "title_ru": "Моя комната",
              "goal_ru": "После урока ты сможешь описать свою комнату: что в ней есть и чего нет.",
              "detail": "full",
              "file": "lessons/a1/a1-m2-l1.json"
            },
            {
              "id": "a1-m2-l2",
              "title_ru": "В, на, под",
              "goal_ru": "После урока ты сможешь сказать, где лежит вещь, и спросить, где она.",
              "detail": "full",
              "file": "lessons/a1/a1-m2-l2.json"
            },
            {
              "id": "a1-m2-l3",
              "title_ru": "Мой город",
              "goal_ru": "После урока ты сможешь рассказать, что есть в твоём городе и районе.",
              "detail": "full",
              "file": "lessons/a1/a1-m2-l3.json"
            },
            {
              "id": "a1-m2-l4",
              "title_ru": "Как пройти?",
              "goal_ru": "После урока ты сможешь спросить дорогу и объяснить, как пройти.",
              "detail": "full",
              "file": "lessons/a1/a1-m2-l4.json"
            }
          ]
        },
        {
          "id": "a1-m3",
          "title_ru": "Еда и магазин",
          "title_en": "Food and shopping",
          "goal_ru": "Еда, some/any, цены, заказ в кафе и рассказ о любимом блюде.",
          "lessons": [
            {
              "id": "a1-m3-l1",
              "title_ru": "Что в холодильнике?",
              "goal_ru": "После урока ты сможешь сказать, какая еда есть дома, и спросить, есть ли что-то.",